{
  "id": "paul-ramsay",
  "name": "Paul Ramsay Foundation",
  "shortName": "PRF",
  "funderType": "foundation",
  "city": "sydney",
  "lat": -33.866,
  "lng": 151.211,
  "focus": "Australia's largest philanthropic foundation. Funds programs breaking cycles of disadvantage — place-based development, systems change, evaluation. $50k-$500k grants for 1-3 years. Some digital infrastructure funding.",
  "fundingTypes": [
    "grants"
  ],
  "scope": "national",
  "url": "https://www.paulramsayfoundation.org.au/",
  "how": "paulramsayfoundation.org.au",
  "why": "Australia's largest foundation — funds systems change"
}
