{
  "id": "minderoo",
  "name": "Minderoo Foundation",
  "shortName": "Minderoo",
  "funderType": "foundation",
  "city": "perth",
  "lat": -31.953,
  "lng": 115.857,
  "focus": "Catalytic philanthropy — Frontier Technology program alongside Fire & Flood Resilience, Generation One, Thrive by Five. Four programs focus exclusively on Australia. Founded by Andrew and Nicola Forrest.",
  "fundingTypes": [
    "grants",
    "impact-investment"
  ],
  "scope": "international",
  "url": "https://www.minderoo.org/",
  "how": "minderoo.org",
  "why": "Frontier Technology program funds digital commons work"
}
